<?xml version="1.0" encoding="UTF-8"?>
<!DOCTYPE pmProfile PUBLIC "pm/pmProfile.dtd" "pmProfile.dtd">

<pmProfile name="coe-evc" version="570e6fa4b46f">
  <metricGroup name="EVC metrics" id="coe-evc.metrics" protocol="SERVICE" displayType="Normal">
    <metric id="coe-evc.one-way-delay" name="EVC One Way delay SD" parmType="COE_ONEWAY_FRAME_DELAY_SD" desc="EVC One-way delay Source to Destination" protocol="SERVICE" licenses="ETHERNET_ASSURANCE" units="Milliseconds" conversion-function="NONE" consolidation-function="AVG" displayType="lineSeries-hist" displayColor="BLUE">
      <parameter name="oneWayDelay" collector="SERVICE" oid="IP_SLA_ONEWAY_DELAY_SD" type="GAUGE" indexed="false"/>
      <value rpn="oneWayDelay,1000,/"/>
    </metric>
    <metric id="coe-evc.one-way-delay-ds" name="EVC One Way delay DS" parmType="COE_ONEWAY_FRAME_DELAY_DS" desc="EVC One-way delay Destination to Source" protocol="SERVICE" licenses="ETHERNET_ASSURANCE" units="Milliseconds" conversion-function="NONE" consolidation-function="AVG" displayType="lineSeries-hist" displayColor="DARK_GREEN">
      <parameter name="oneWayDelayDs" collector="SERVICE" oid="IP_SLA_ONEWAY_DELAY_DS" type="GAUGE" indexed="false"/>
      <value rpn="oneWayDelayDs,1000,/"/>
    </metric>
    <metric id="coe-evc.two-way-delay" name="EVC Two Way delay" parmType="COE_TWOWAY_FRAME_DELAY" desc="EVC Two-way delay" protocol="SERVICE" licenses="ETHERNET_ASSURANCE" units="Milliseconds" conversion-function="NONE" consolidation-function="AVG" displayType="lineSeries-hist" displayColor="DARK_GREEN">
      <parameter name="twoWayDelay" collector="SERVICE" oid="IP_SLA_RTT" type="GAUGE" indexed="false"/>
      <value rpn="twoWayDelay,1000,/"/>
    </metric>
    <metric id="coe-evc.one-way-jitter" name="EVC One Way Jitter SD" parmType="COE_ONEWAY_FRAME_DELAY_VAR_SD" desc="EVC One-way Jitter Source to Destination" protocol="SERVICE" licenses="ETHERNET_ASSURANCE" units="Microseconds" conversion-function="NONE" consolidation-function="AVG" displayType="lineSeries-hist" displayColor="BLUE">
      <parameter name="oneWayJitter" collector="SERVICE" oid="IP_SLA_LATENCY_SD" type="GAUGE" indexed="false"/>
      <value rpn="oneWayJitter,0,+"/>
    </metric>
    <metric id="coe-evc.one-way-jitter-ds" name="EVC One Way Jitter DS" parmType="COE_ONEWAY_FRAME_DELAY_VAR_DS" desc="EVC One-way Jitter Destination to Source" protocol="SERVICE" licenses="ETHERNET_ASSURANCE" units="Microseconds" conversion-function="NONE" consolidation-function="AVG" displayType="lineSeries-hist" displayColor="DARK_GREEN">
      <parameter name="oneWayJitterDs" collector="SERVICE" oid="IP_SLA_LATENCY_DS" type="GAUGE" indexed="false"/>
      <value rpn="oneWayJitterDs,0,+"/>
    </metric>
    <metric id="coe-evc.two-way-jitter" name="EVC Two Way Jitter" parmType="COE_TWOWAY_FRAME_DELAY_VAR" desc="EVC Two-way Jitter" protocol="SERVICE" licenses="ETHERNET_ASSURANCE" units="Microseconds" conversion-function="NONE" consolidation-function="AVG" displayType="lineSeries-hist" displayColor="DARK_GREEN">
      <parameter name="twoWayJitter" collector="SERVICE" oid="IP_SLA_JITTER" type="GAUGE" indexed="false"/>
      <value rpn="twoWayJitter,0,+"/>
    </metric>
    <metric id="coe-evc.frame-loss-in-evc" name="EVC Frame Loss" parmType="COE_FRAME_LOSS_RATIO" desc="EVC Frame loss" protocol="SERVICE" licenses="ETHERNET_ASSURANCE" units="frames" conversion-function="NONE" consolidation-function="AVG" displayType="lineSeries-hist" displayColor="DARK_GREEN">
      <parameter name="frameLoss" collector="SERVICE" oid="IP_SLA_FRAMELOSS_RATIO" type="GAUGE" indexed="false"/>
      <value rpn="frameLoss,0,+"/>
    </metric>
    <metric id="coe-evc.evc-uptime" name="EVC Uptime" parmType="STATE_UPTIME" desc="EVC Uptime" protocol="SERVICE" licenses="ETHERNET_ASSURANCE" units="milliseconds" conversion-function="PER_PERIOD" consolidation-function="SUM" displayType="lineSeries-hist" displayColor="DARK_GREEN">
      <parameter name="upTime" collector="OBJECT" oid="upTime" type="COUNTER" indexed="false"/>
      <parameter name="timeStampUpToDown" collector="OBJECT" oid="timeStampUpToDown" type="COUNTER" indexed="false"/>
      <parameter name="timeStampDownToUp" collector="OBJECT" oid="timeStampDownToUp" type="COUNTER" indexed="false"/>
      <parameter name="currentPollTime" collector="SYSTEM" oid="POLL_TIME" type="COUNTER" indexed="false"/>
      <value rpn="timeStampDownToUp,timeStampUpToDown,GT,upTime,currentPollTime,timeStampDownToUp,-,+,upTime,IF"/>
    </metric>
    <metric id="coe-evc.evc-downtime" name="EVC Downtime" parmType="STATE_DOWNTIME" desc="EVC Downtime" protocol="SERVICE" licenses="ETHERNET_ASSURANCE" units="milliseconds" conversion-function="PER_PERIOD" consolidation-function="SUM" displayType="lineSeries-hist" displayColor="DARK_GREEN">
      <parameter name="downTime" collector="OBJECT" oid="downTime" type="COUNTER" indexed="false"/>
      <parameter name="timeStampUpToDown" collector="OBJECT" oid="timeStampUpToDown" type="COUNTER" indexed="false"/>
      <parameter name="timeStampDownToUp" collector="OBJECT" oid="timeStampDownToUp" type="COUNTER" indexed="false"/>
      <parameter name="currentPollTime" collector="SYSTEM" oid="POLL_TIME" type="COUNTER" indexed="false"/>
      <value rpn="timeStampUpToDown,timeStampDownToUp,GT,downTime,currentPollTime,timeStampUpToDown,-,+,downTime,IF"/>
    </metric>
    <metric id="coe-evc.availablility-in-evc" name="EVC Availability" parmType="COE_AVAILABILITY" desc="EVC Availability" protocol="METRIC" licenses="ETHERNET_ASSURANCE" units="%" conversion-function="NONE" consolidation-function="AVG" displayType="lineSeries-hist" displayColor="DARK_GREEN">
      <parameter name="upTimeMetric" collector="METRIC" oid="STATE_UPTIME" type="COUNTER"/>
      <parameter name="downTimeMetric" collector="METRIC" oid="STATE_DOWNTIME" type="COUNTER"/>
      <value rpn="upTimeMetric,upTimeMetric,downTimeMetric,+,/,100,*"/>
    </metric>
    <metric id="coe-evc.evc-rx-avg-mbps" name="EVC Rx Avg Throughput" parmType="COE_RX_AVG_MBPS" desc="EVC average Mbps received" protocol="SERVICE" licenses="ETHERNET_ASSURANCE" units="Mbps" conversion-function="NONE" consolidation-function="AVG" displayType="lineSeries-hist" displayColor="DARK_GREEN">
      <parameter name="rxAvgMbps" collector="SERVICE" oid="ETH_RX_BANDWIDTH" type="GAUGE" indexed="false"/>
      <value rpn="rxAvgMbps,1000000,/"/>
    </metric>
    <metric id="coe-evc.evc-tx-avg-mbps" name="EVC Tx Avg Throughput" parmType="COE_TX_AVG_MBPS" desc="EVC average Mbps transmitted" protocol="SERVICE" licenses="ETHERNET_ASSURANCE" units="Mbps" conversion-function="NONE" consolidation-function="AVG" displayType="lineSeries-hist" displayColor="BLUE">
      <parameter name="txAvgMbps" collector="SERVICE" oid="ETH_TX_BANDWIDTH" type="GAUGE" indexed="false"/>
      <value rpn="txAvgMbps,1000000,/"/>
    </metric>
    <metric id="coe-evc.throughput-of-evc" name="EVC Max Avg Throughput" parmType="COE_THROUGHPUT" desc="EVC Max Avg Mbps" protocol="SERVICE" licenses="ETHERNET_ASSURANCE" units="Mbps" conversion-function="NONE" consolidation-function="AVG" displayType="lineSeries-hist" displayColor="DARK_GREEN">
      <parameter name="rxAvg" collector="SERVICE" oid="ETH_RX_BANDWIDTH" type="GAUGE" indexed="false"/>
      <parameter name="txAvg" collector="SERVICE" oid="ETH_TX_BANDWIDTH" type="GAUGE" indexed="false"/>
      <value rpn="rxAvg,txAvg,MAX"/>
    </metric>
    <metric id="coe-evc.rx-utilization-of-evc" name="EVC Rx Avg Utilization" parmType="COE_RX_UTILIZATION" desc="EVC Rx Avg Utilization" protocol="SERVICE" licenses="ETHERNET_ASSURANCE" units="%" conversion-function="NONE" consolidation-function="AVG" displayType="lineSeries-hist" displayColor="DARK_GREEN">
      <parameter name="rxUtil" collector="SERVICE" oid="ETH_RX_UTILIZATION" type="GAUGE" indexed="false"/>
      <value rpn="rxUtil,0,+"/>
    </metric>
    <metric id="coe-evc.tx-utilization-of-evc" name="EVC Tx Avg Utilization" parmType="COE_TX_UTILIZATION" desc="EVC Tx Avg Utilization" protocol="SERVICE" licenses="ETHERNET_ASSURANCE" units="%" conversion-function="NONE" consolidation-function="AVG" displayType="lineSeries-hist" displayColor="BLUE">
      <parameter name="txUtil" collector="SERVICE" oid="ETH_TX_UTILIZATION" type="GAUGE" indexed="false"/>
      <value rpn="txUtil,0,+"/>
    </metric>
    <metric id="coe-evc.utilization-of-evc" name="EVC Max Utilization" parmType="COE_UTILIZATION" desc="EVC Max Utilization" protocol="SERVICE" licenses="ETHERNET_ASSURANCE" units="%" conversion-function="NONE" consolidation-function="AVG" displayType="lineSeries-hist" displayColor="DARK_GREEN">
      <parameter name="rxutilization" collector="SERVICE" oid="ETH_RX_UTILIZATION" type="GAUGE" indexed="false"/>
      <parameter name="txutilization" collector="SERVICE" oid="ETH_TX_UTILIZATION" type="GAUGE" indexed="false"/>
      <value rpn="rxutilization,txutilization,MAX"/>
    </metric>
  </metricGroup>
</pmProfile>
